"rt","stimulus","response","typeoftrial","subject","trial_type","trial_index","time_elapsed","internal_node_id","run_id","condition","recorded_at","source_code_version","ip","user_agent","device","browser","browser_version","platform","platform_version","question_order","practice_rating","sentence_num","rating"
"34409","
        <p style=""font-size:20px;""> Welcome! Thank you for your interest in our study. </p>
        <p style=""font-size:20px;""> This study is being conducted by researchers at Bowdoin College.</p>
        <p style=""font-size:20px;""> In this experiment, you will be asked to rate the accuracy of English and Spanish translations.</p>
        <p style=""font-size:20px;""> The entire experiment should not last more than 20 minutes. You will be paid $3 USD for your participation. </p>
        <p style=""font-size:20px;""> Please click <a href = ""https://drive.google.com/file/d/1L92a02eEKCpaAEipmqDcBCDR7rsarqFE/view?usp=sharing"" target = ""_blank"">here</a> to read the full consent form. </p>
        <p style=""font-size:20px;""> If you agree to participate, please click the button below to continue to experiment instructions.</p>
        ","0","consent","5019","html-button-response","0","34413","0.0-0.0","26","1","2022-11-29 21:24:53","2df368f4e41f066fd1c82c297b4a1108","77.229.212.211","Mozilla/5.0 (Windows NT 10.0; Win64; x64) AppleWebKit/537.36 (KHTML, like Gecko) Chrome/107.0.0.0 Safari/537.36","WebKit","Chrome","107.0.0.0","Windows","10.0","","","",""
"6928","","{""ID"":""5d60061e45714d00019ad6a4""}","ID","5019","survey-text","1","41346","0.0-1.0","26","1","2022-11-29 21:24:53","2df368f4e41f066fd1c82c297b4a1108","77.229.212.211","Mozilla/5.0 (Windows NT 10.0; Win64; x64) AppleWebKit/537.36 (KHTML, like Gecko) Chrome/107.0.0.0 Safari/537.36","WebKit","Chrome","107.0.0.0","Windows","10.0","","","",""
"18245","
        <p style=""font-size:20px;""> You are about to begin the practice test. </p>
        <p style=""font-size:20px;""> On each trial, you will see a sentence in English and its corresponding Spanish translation. </p>
        <p style=""font-size:20px;""> You will rate the accuracy of the translation on a scale from ""Not at all accurate"" to ""Very accurate."" </p>
        <p style=""font-size:20px;""> If you rate the translation as ""Somewhat innaccurate"" or ""Not at all accurate,"" you will be asked to provide your own translation or a reason why the translation is inaccurate. </p>
        <p style=""font-size:20px;""> Click the button below to continue to the practice session.</p>","0","instructions","5019","html-button-response","2","59592","0.0-2.0","26","1","2022-11-29 21:24:53","2df368f4e41f066fd1c82c297b4a1108","77.229.212.211","Mozilla/5.0 (Windows NT 10.0; Win64; x64) AppleWebKit/537.36 (KHTML, like Gecko) Chrome/107.0.0.0 Safari/537.36","WebKit","Chrome","107.0.0.0","Windows","10.0","","","",""
"12913","You drop a bowling ball on a mircrowave <br> T&uacute tiras una bola de boliche a un horno","{""Q0"":4}","practice","5019","survey-likert","3","72510","0.0-3.0-0.0","26","1","2022-11-29 21:24:53","2df368f4e41f066fd1c82c297b4a1108","77.229.212.211","Mozilla/5.0 (Windows NT 10.0; Win64; x64) AppleWebKit/537.36 (KHTML, like Gecko) Chrome/107.0.0.0 Safari/537.36","WebKit","Chrome","107.0.0.0","Windows","10.0","[0]","4","",""
"4846","You see how a teacher is drawing a picture <br> T&uacute ves como un maestro pinta una foto","{""Q0"":4}","practice","5019","survey-likert","4","77361","0.0-3.0-0.1","26","1","2022-11-29 21:24:53","2df368f4e41f066fd1c82c297b4a1108","77.229.212.211","Mozilla/5.0 (Windows NT 10.0; Win64; x64) AppleWebKit/537.36 (KHTML, like Gecko) Chrome/107.0.0.0 Safari/537.36","WebKit","Chrome","107.0.0.0","Windows","10.0","[0]","4","",""
"14828","You drop a rock on a phone <br> T&uacute tiras una piedra a un tel&eacutefono","{""Q0"":1}","practice","5019","survey-likert","5","92194","0.0-3.0-0.2","26","1","2022-11-29 21:24:53","2df368f4e41f066fd1c82c297b4a1108","77.229.212.211","Mozilla/5.0 (Windows NT 10.0; Win64; x64) AppleWebKit/537.36 (KHTML, like Gecko) Chrome/107.0.0.0 Safari/537.36","WebKit","Chrome","107.0.0.0","Windows","10.0","[0]","1","",""
"20504","You drop a rock on a phone <br> T&uacute tiras una piedra a un tel&eacutefono","{""Q0"":""Tiras una piedra encima de un teléfono.""}","practice_low_rate","5019","survey-text","6","112705","0.0-3.0-1.2-0.2","26","1","2022-11-29 21:24:53","2df368f4e41f066fd1c82c297b4a1108","77.229.212.211","Mozilla/5.0 (Windows NT 10.0; Win64; x64) AppleWebKit/537.36 (KHTML, like Gecko) Chrome/107.0.0.0 Safari/537.36","WebKit","Chrome","107.0.0.0","Windows","10.0","","","1",""
"14904","You see how a tiger is playing with a goose <br> T&uacute ves como un le&oacuten come una pizza","{""Q0"":0}","practice","5019","survey-likert","7","127613","0.0-3.0-0.3","26","1","2022-11-29 21:24:53","2df368f4e41f066fd1c82c297b4a1108","77.229.212.211","Mozilla/5.0 (Windows NT 10.0; Win64; x64) AppleWebKit/537.36 (KHTML, like Gecko) Chrome/107.0.0.0 Safari/537.36","WebKit","Chrome","107.0.0.0","Windows","10.0","[0]","0","",""
"9045","You see how a tiger is playing with a goose <br> T&uacute ves como un le&oacuten come una pizza","{""Q0"":""Tú ves como un tigre juega con un ganso.""}","practice_low_rate","5019","survey-text","8","136663","0.0-3.0-1.3-0.3","26","1","2022-11-29 21:24:53","2df368f4e41f066fd1c82c297b4a1108","77.229.212.211","Mozilla/5.0 (Windows NT 10.0; Win64; x64) AppleWebKit/537.36 (KHTML, like Gecko) Chrome/107.0.0.0 Safari/537.36","WebKit","Chrome","107.0.0.0","Windows","10.0","","","5",""
"4605","You see how an artist is running <br> T&uacute ves como un artista est&aacute corriendo","{""Q0"":4}","practice","5019","survey-likert","9","141269","0.0-3.0-0.4","26","1","2022-11-29 21:24:53","2df368f4e41f066fd1c82c297b4a1108","77.229.212.211","Mozilla/5.0 (Windows NT 10.0; Win64; x64) AppleWebKit/537.36 (KHTML, like Gecko) Chrome/107.0.0.0 Safari/537.36","WebKit","Chrome","107.0.0.0","Windows","10.0","[0]","4","",""
"5208","You see how a duck is playing with a pumpkin <br> T&uacute ves como un pato est&aacute jugando con una calabaza","{""Q0"":4}","practice","5019","survey-likert","10","146482","0.0-3.0-0.5","26","1","2022-11-29 21:24:53","2df368f4e41f066fd1c82c297b4a1108","77.229.212.211","Mozilla/5.0 (Windows NT 10.0; Win64; x64) AppleWebKit/537.36 (KHTML, like Gecko) Chrome/107.0.0.0 Safari/537.36","WebKit","Chrome","107.0.0.0","Windows","10.0","[0]","4","",""
"3352","<p style=""font-size:20px;"">You have now completed the practice session! </p>
        <p style=""font-size:20px;"">You will now move on to the main experiment. </p>
        <p style=""font-size:20px;"">Please click the button below to continue. </p>","0","movetoexp","5019","html-button-response","11","149839","0.0-4.0","26","1","2022-11-29 21:24:53","2df368f4e41f066fd1c82c297b4a1108","77.229.212.211","Mozilla/5.0 (Windows NT 10.0; Win64; x64) AppleWebKit/537.36 (KHTML, like Gecko) Chrome/107.0.0.0 Safari/537.36","WebKit","Chrome","107.0.0.0","Windows","10.0","","","",""
"4708","You drop a bowling ball on an iPAD <br> T&uacute tiras una bola de boliche a un iPad","{""Q0"":3}","trial","5019","survey-likert","12","154549","0.0-5.0-0.0","26","1","2022-11-29 21:24:53","2df368f4e41f066fd1c82c297b4a1108","77.229.212.211","Mozilla/5.0 (Windows NT 10.0; Win64; x64) AppleWebKit/537.36 (KHTML, like Gecko) Chrome/107.0.0.0 Safari/537.36","WebKit","Chrome","107.0.0.0","Windows","10.0","[0]","","12","3"
"6177","You drop a thermometer on the box <br> T&uacute tiras un term&oacutemetro a la caja","{""Q0"":2}","trial","5019","survey-likert","13","160732","0.0-5.0-0.1","26","1","2022-11-29 21:24:53","2df368f4e41f066fd1c82c297b4a1108","77.229.212.211","Mozilla/5.0 (Windows NT 10.0; Win64; x64) AppleWebKit/537.36 (KHTML, like Gecko) Chrome/107.0.0.0 Safari/537.36","WebKit","Chrome","107.0.0.0","Windows","10.0","[0]","","70","2"
"3761","You see how a man is shaving his beard <br> T&uacute ves como un hombre se est&aacute afeitando la barba","{""Q0"":4}","trial","5019","survey-likert","14","164498","0.0-5.0-0.2","26","1","2022-11-29 21:24:53","2df368f4e41f066fd1c82c297b4a1108","77.229.212.211","Mozilla/5.0 (Windows NT 10.0; Win64; x64) AppleWebKit/537.36 (KHTML, like Gecko) Chrome/107.0.0.0 Safari/537.36","WebKit","Chrome","107.0.0.0","Windows","10.0","[0]","","43","4"
"3615","You see how a cat is drinking water from a bowl <br> T&uacute ves como un gato est&aacute bebiendo agua de un cuenco","{""Q0"":4}","trial","5019","survey-likert","15","168118","0.0-5.0-0.3","26","1","2022-11-29 21:24:53","2df368f4e41f066fd1c82c297b4a1108","77.229.212.211","Mozilla/5.0 (Windows NT 10.0; Win64; x64) AppleWebKit/537.36 (KHTML, like Gecko) Chrome/107.0.0.0 Safari/537.36","WebKit","Chrome","107.0.0.0","Windows","10.0","[0]","","28","4"
"4445","You see how a giraffe is playing with a zebra <br> T&uacute ves como una jirafa est&aacute jugando con una cebra","{""Q0"":4}","trial","5019","survey-likert","16","172569","0.0-5.0-0.4","26","1","2022-11-29 21:24:53","2df368f4e41f066fd1c82c297b4a1108","77.229.212.211","Mozilla/5.0 (Windows NT 10.0; Win64; x64) AppleWebKit/537.36 (KHTML, like Gecko) Chrome/107.0.0.0 Safari/537.36","WebKit","Chrome","107.0.0.0","Windows","10.0","[0]","","65","4"
"4028","You drop a bowling ball on a ceramic plate <br> T&uacute tiras una bola de boliche a un plato de cer&aacutemica","{""Q0"":4}","trial","5019","survey-likert","17","176601","0.0-5.0-0.5","26","1","2022-11-29 21:24:53","2df368f4e41f066fd1c82c297b4a1108","77.229.212.211","Mozilla/5.0 (Windows NT 10.0; Win64; x64) AppleWebKit/537.36 (KHTML, like Gecko) Chrome/107.0.0.0 Safari/537.36","WebKit","Chrome","107.0.0.0","Windows","10.0","[0]","","19","4"
"6032","You drop a bowling ball on a paper cup <br> T&uacute tiras una bola de boliche a un vaso de papel","{""Q0"":4}","trial","5019","survey-likert","18","182639","0.0-5.0-0.6","26","1","2022-11-29 21:24:53","2df368f4e41f066fd1c82c297b4a1108","77.229.212.211","Mozilla/5.0 (Windows NT 10.0; Win64; x64) AppleWebKit/537.36 (KHTML, like Gecko) Chrome/107.0.0.0 Safari/537.36","WebKit","Chrome","107.0.0.0","Windows","10.0","[0]","","24","4"
"4106","You drop a fork on the plate <br> T&uacute tiras un tenedor al plato","{""Q0"":4}","trial","5019","survey-likert","19","186750","0.0-5.0-0.7","26","1","2022-11-29 21:24:53","2df368f4e41f066fd1c82c297b4a1108","77.229.212.211","Mozilla/5.0 (Windows NT 10.0; Win64; x64) AppleWebKit/537.36 (KHTML, like Gecko) Chrome/107.0.0.0 Safari/537.36","WebKit","Chrome","107.0.0.0","Windows","10.0","[0]","","26","4"
"3810","You drop a bowling ball on a cracker <br> T&uacute tiras una bola de boliche a una galleta","{""Q0"":4}","trial","5019","survey-likert","20","190563","0.0-5.0-0.8","26","1","2022-11-29 21:24:53","2df368f4e41f066fd1c82c297b4a1108","77.229.212.211","Mozilla/5.0 (Windows NT 10.0; Win64; x64) AppleWebKit/537.36 (KHTML, like Gecko) Chrome/107.0.0.0 Safari/537.36","WebKit","Chrome","107.0.0.0","Windows","10.0","[0]","","4","4"
"3105","You see how a boy is peeling a banana <br> T&uacute ves como un ni&ntildeo est&aacute pelando una banana","{""Q0"":4}","trial","5019","survey-likert","21","193673","0.0-5.0-0.9","26","1","2022-11-29 21:24:53","2df368f4e41f066fd1c82c297b4a1108","77.229.212.211","Mozilla/5.0 (Windows NT 10.0; Win64; x64) AppleWebKit/537.36 (KHTML, like Gecko) Chrome/107.0.0.0 Safari/537.36","WebKit","Chrome","107.0.0.0","Windows","10.0","[0]","","30","4"
"5561","You see how a panda is resting on a tree <br> T&uacute ves como un panda est&aacute descansando en un &aacuterbol","{""Q0"":4}","trial","5019","survey-likert","22","199239","0.0-5.0-0.10","26","1","2022-11-29 21:24:53","2df368f4e41f066fd1c82c297b4a1108","77.229.212.211","Mozilla/5.0 (Windows NT 10.0; Win64; x64) AppleWebKit/537.36 (KHTML, like Gecko) Chrome/107.0.0.0 Safari/537.36","WebKit","Chrome","107.0.0.0","Windows","10.0","[0]","","57","4"
"4068","You drop a bowling ball on a blackberry <br> T&uacute tiras una bola de boliche a una mora","{""Q0"":4}","trial","5019","survey-likert","23","203313","0.0-5.0-0.11","26","1","2022-11-29 21:24:53","2df368f4e41f066fd1c82c297b4a1108","77.229.212.211","Mozilla/5.0 (Windows NT 10.0; Win64; x64) AppleWebKit/537.36 (KHTML, like Gecko) Chrome/107.0.0.0 Safari/537.36","WebKit","Chrome","107.0.0.0","Windows","10.0","[0]","","8","4"
"5312","You drop a ring on the newspaper <br> T&uacute tiras un anillo al peri&oacutedico","{""Q0"":4}","trial","5019","survey-likert","24","208631","0.0-5.0-0.12","26","1","2022-11-29 21:24:53","2df368f4e41f066fd1c82c297b4a1108","77.229.212.211","Mozilla/5.0 (Windows NT 10.0; Win64; x64) AppleWebKit/537.36 (KHTML, like Gecko) Chrome/107.0.0.0 Safari/537.36","WebKit","Chrome","107.0.0.0","Windows","10.0","[0]","","41","4"
"23271","You drop a bowling ball on a tomato <br> T&uacute tiras una bola de boliche a un tomate","{""Q0"":1}","trial","5019","survey-likert","25","231906","0.0-5.0-0.13","26","1","2022-11-29 21:24:53","2df368f4e41f066fd1c82c297b4a1108","77.229.212.211","Mozilla/5.0 (Windows NT 10.0; Win64; x64) AppleWebKit/537.36 (KHTML, like Gecko) Chrome/107.0.0.0 Safari/537.36","WebKit","Chrome","107.0.0.0","Windows","10.0","[0]","","23","1"
"6998","You drop a bowling ball on a tomato <br> T&uacute tiras una bola de boliche a un tomate","{""Q0"":""Tú tiras una bola sobre un tomate.""}","low_rate","5019","survey-text","26","238913","0.0-5.0-1.13-0.13","26","1","2022-11-29 21:24:53","2df368f4e41f066fd1c82c297b4a1108","77.229.212.211","Mozilla/5.0 (Windows NT 10.0; Win64; x64) AppleWebKit/537.36 (KHTML, like Gecko) Chrome/107.0.0.0 Safari/537.36","WebKit","Chrome","107.0.0.0","Windows","10.0","","","23",""
"6423","You drop a bowling ball on a hat <br> T&uacute tiras una bola de boliche a una gorra","{""Q0"":1}","trial","5019","survey-likert","27","245338","0.0-5.0-0.14","26","1","2022-11-29 21:24:53","2df368f4e41f066fd1c82c297b4a1108","77.229.212.211","Mozilla/5.0 (Windows NT 10.0; Win64; x64) AppleWebKit/537.36 (KHTML, like Gecko) Chrome/107.0.0.0 Safari/537.36","WebKit","Chrome","107.0.0.0","Windows","10.0","[0]","","10","1"
