"rt","stimulus","response","typeoftrial","subject","trial_type","trial_index","time_elapsed","internal_node_id","run_id","condition","recorded_at","source_code_version","ip","user_agent","device","browser","browser_version","platform","platform_version","question_order","practice_rating","sentence_num","rating","Experiment"
"13288","
        <p style=""font-size:20px;""> Welcome! Thank you for your interest in our study. </p>
        <p style=""font-size:20px;""> This study is being conducted by researchers at Bowdoin College.</p>
        <p style=""font-size:20px;""> In this experiment, you will be asked to rate the accuracy of English and Spanish translations.</p>
        <p style=""font-size:20px;""> The entire experiment should not last more than 20 minutes. You will be paid $3 USD for your participation. </p>
        <p style=""font-size:20px;""> Please click <a href = ""https://drive.google.com/file/d/1L92a02eEKCpaAEipmqDcBCDR7rsarqFE/view?usp=sharing"" target = ""_blank"">here</a> to read the full consent form. </p>
        <p style=""font-size:20px;""> If you agree to participate, please click the button below to continue to experiment instructions.</p>
        ","0","consent","41944","html-button-response","0","13291","0.0-0.0","66","1","2022-11-29 22:30:12","2df368f4e41f066fd1c82c297b4a1108","189.145.205.164","Mozilla/5.0 (Windows NT 10.0; Win64; x64) AppleWebKit/537.36 (KHTML, like Gecko) Chrome/107.0.0.0 Safari/537.36","WebKit","Chrome","107.0.0.0","Windows","10.0","","","","",""
"3839","","{""ID"":""613a469755c08ab3b9d682ad""}","ID","41944","survey-text","1","17138","0.0-1.0","66","1","2022-11-29 22:30:12","2df368f4e41f066fd1c82c297b4a1108","189.145.205.164","Mozilla/5.0 (Windows NT 10.0; Win64; x64) AppleWebKit/537.36 (KHTML, like Gecko) Chrome/107.0.0.0 Safari/537.36","WebKit","Chrome","107.0.0.0","Windows","10.0","","","","",""
"13678","
        <p style=""font-size:20px;""> You are about to begin the practice test. </p>
        <p style=""font-size:20px;""> On each trial, you will see a sentence in English and its corresponding Spanish translation. </p>
        <p style=""font-size:20px;""> You will rate the accuracy of the translation on a scale from ""Not at all accurate"" to ""Very accurate."" </p>
        <p style=""font-size:20px;""> If you rate the translation as ""Somewhat innaccurate"" or ""Not at all accurate,"" you will be asked to provide your own translation or a reason why the translation is inaccurate. </p>
        <p style=""font-size:20px;""> Click the button below to continue to the practice session.</p>","0","instructions","41944","html-button-response","2","30818","0.0-2.0","66","1","2022-11-29 22:30:12","2df368f4e41f066fd1c82c297b4a1108","189.145.205.164","Mozilla/5.0 (Windows NT 10.0; Win64; x64) AppleWebKit/537.36 (KHTML, like Gecko) Chrome/107.0.0.0 Safari/537.36","WebKit","Chrome","107.0.0.0","Windows","10.0","","","","",""
"13638","You drop a rock on a phone <br> T&uacute tiras una piedra a un tel&eacutefono","{""Q0"":4}","practice","41944","survey-likert","3","44458","0.0-3.0-0.0","66","1","2022-11-29 22:30:12","2df368f4e41f066fd1c82c297b4a1108","189.145.205.164","Mozilla/5.0 (Windows NT 10.0; Win64; x64) AppleWebKit/537.36 (KHTML, like Gecko) Chrome/107.0.0.0 Safari/537.36","WebKit","Chrome","107.0.0.0","Windows","10.0","[0]","4","","",""
"9723","You see how a duck is playing with a pumpkin <br> T&uacute ves como un pato est&aacute jugando con una calabaza","{""Q0"":4}","practice","41944","survey-likert","4","54186","0.0-3.0-0.1","66","1","2022-11-29 22:30:12","2df368f4e41f066fd1c82c297b4a1108","189.145.205.164","Mozilla/5.0 (Windows NT 10.0; Win64; x64) AppleWebKit/537.36 (KHTML, like Gecko) Chrome/107.0.0.0 Safari/537.36","WebKit","Chrome","107.0.0.0","Windows","10.0","[0]","4","","",""
"10988","You see how an artist is running <br> T&uacute ves como un artista est&aacute corriendo","{""Q0"":4}","practice","41944","survey-likert","5","65177","0.0-3.0-0.2","66","1","2022-11-29 22:30:12","2df368f4e41f066fd1c82c297b4a1108","189.145.205.164","Mozilla/5.0 (Windows NT 10.0; Win64; x64) AppleWebKit/537.36 (KHTML, like Gecko) Chrome/107.0.0.0 Safari/537.36","WebKit","Chrome","107.0.0.0","Windows","10.0","[0]","4","","",""
"8220","You see how a tiger is playing with a goose <br> T&uacute ves como un le&oacuten come una pizza","{""Q0"":0}","practice","41944","survey-likert","6","73401","0.0-3.0-0.3","66","1","2022-11-29 22:30:12","2df368f4e41f066fd1c82c297b4a1108","189.145.205.164","Mozilla/5.0 (Windows NT 10.0; Win64; x64) AppleWebKit/537.36 (KHTML, like Gecko) Chrome/107.0.0.0 Safari/537.36","WebKit","Chrome","107.0.0.0","Windows","10.0","[0]","0","","",""
"106114","You see how a tiger is playing with a goose <br> T&uacute ves como un le&oacuten come una pizza","{""Q0"":""The translation was wrong because they were not the same animals nor was it playing with a pizza""}","practice_low_rate","41944","survey-text","7","179521","0.0-3.0-1.3-0.3","66","1","2022-11-29 22:30:12","2df368f4e41f066fd1c82c297b4a1108","189.145.205.164","Mozilla/5.0 (Windows NT 10.0; Win64; x64) AppleWebKit/537.36 (KHTML, like Gecko) Chrome/107.0.0.0 Safari/537.36","WebKit","Chrome","107.0.0.0","Windows","10.0","","","5","",""
"21910","You see how a teacher is drawing a picture <br> T&uacute ves como un maestro pinta una foto","{""Q0"":3}","practice","41944","survey-likert","8","201434","0.0-3.0-0.4","66","1","2022-11-29 22:30:12","2df368f4e41f066fd1c82c297b4a1108","189.145.205.164","Mozilla/5.0 (Windows NT 10.0; Win64; x64) AppleWebKit/537.36 (KHTML, like Gecko) Chrome/107.0.0.0 Safari/537.36","WebKit","Chrome","107.0.0.0","Windows","10.0","[0]","3","","",""
"22484","You drop a bowling ball on a mircrowave <br> T&uacute tiras una bola de boliche a un horno","{""Q0"":3}","practice","41944","survey-likert","9","223922","0.0-3.0-0.5","66","1","2022-11-29 22:30:12","2df368f4e41f066fd1c82c297b4a1108","189.145.205.164","Mozilla/5.0 (Windows NT 10.0; Win64; x64) AppleWebKit/537.36 (KHTML, like Gecko) Chrome/107.0.0.0 Safari/537.36","WebKit","Chrome","107.0.0.0","Windows","10.0","[0]","3","","",""
"3076","<p style=""font-size:20px;"">You have now completed the practice session! </p>
        <p style=""font-size:20px;"">You will now move on to the main experiment. </p>
        <p style=""font-size:20px;"">Please click the button below to continue. </p>","0","movetoexp","41944","html-button-response","10","227001","0.0-4.0","66","1","2022-11-29 22:30:12","2df368f4e41f066fd1c82c297b4a1108","189.145.205.164","Mozilla/5.0 (Windows NT 10.0; Win64; x64) AppleWebKit/537.36 (KHTML, like Gecko) Chrome/107.0.0.0 Safari/537.36","WebKit","Chrome","107.0.0.0","Windows","10.0","","","","",""
"33263","You drop a bowling ball on a tile <br> T&uacute tiras una bola de boliche a una baldosa","{""Q0"":4}","trial","41944","survey-likert","11","260266","0.0-5.0-0.0","66","1","2022-11-29 22:30:12","2df368f4e41f066fd1c82c297b4a1108","189.145.205.164","Mozilla/5.0 (Windows NT 10.0; Win64; x64) AppleWebKit/537.36 (KHTML, like Gecko) Chrome/107.0.0.0 Safari/537.36","WebKit","Chrome","107.0.0.0","Windows","10.0","[0]","","22","4",""
"7163","You see how a parrot is eating an apple <br> T&uacute ves como un loro est&aacute comiendo una manzana","{""Q0"":4}","trial","41944","survey-likert","12","267433","0.0-5.0-0.1","66","1","2022-11-29 22:30:12","2df368f4e41f066fd1c82c297b4a1108","189.145.205.164","Mozilla/5.0 (Windows NT 10.0; Win64; x64) AppleWebKit/537.36 (KHTML, like Gecko) Chrome/107.0.0.0 Safari/537.36","WebKit","Chrome","107.0.0.0","Windows","10.0","[0]","","58","4",""
"8252","You see how a teenage girl is playing the piano <br> T&uacute ves como una ni&ntildea adolescente est&aacute tocando el piano","{""Q0"":4}","trial","41944","survey-likert","13","275689","0.0-5.0-0.2","66","1","2022-11-29 22:30:12","2df368f4e41f066fd1c82c297b4a1108","189.145.205.164","Mozilla/5.0 (Windows NT 10.0; Win64; x64) AppleWebKit/537.36 (KHTML, like Gecko) Chrome/107.0.0.0 Safari/537.36","WebKit","Chrome","107.0.0.0","Windows","10.0","[0]","","54","4",""
"10709","You see how a man is boiling potatoes <br> T&uacute ves a un hombre est&aacute hirviendo papas","{""Q0"":1}","trial","41944","survey-likert","14","286401","0.0-5.0-0.3","66","1","2022-11-29 22:30:12","2df368f4e41f066fd1c82c297b4a1108","189.145.205.164","Mozilla/5.0 (Windows NT 10.0; Win64; x64) AppleWebKit/537.36 (KHTML, like Gecko) Chrome/107.0.0.0 Safari/537.36","WebKit","Chrome","107.0.0.0","Windows","10.0","[0]","","46","1",""
"48915","You see how a man is boiling potatoes <br> T&uacute ves a un hombre est&aacute hirviendo papas","{""Q0"":""The tenses were not correct""}","low_rate","41944","survey-text","15","335321","0.0-5.0-1.3-0.3","66","1","2022-11-29 22:30:12","2df368f4e41f066fd1c82c297b4a1108","189.145.205.164","Mozilla/5.0 (Windows NT 10.0; Win64; x64) AppleWebKit/537.36 (KHTML, like Gecko) Chrome/107.0.0.0 Safari/537.36","WebKit","Chrome","107.0.0.0","Windows","10.0","","","46","",""
"7846","You drop a bowling ball on a porcelain figure <br> T&uacute tiras una bola de boliche a una figura de porcelana","{""Q0"":4}","trial","41944","survey-likert","16","343169","0.0-5.0-0.4","66","1","2022-11-29 22:30:12","2df368f4e41f066fd1c82c297b4a1108","189.145.205.164","Mozilla/5.0 (Windows NT 10.0; Win64; x64) AppleWebKit/537.36 (KHTML, like Gecko) Chrome/107.0.0.0 Safari/537.36","WebKit","Chrome","107.0.0.0","Windows","10.0","[0]","","1","4",""
"9076","You drop a bowling ball on a chocolate muffin <br> T&uacute tiras una bola de boliche a una magdalena de chocolate","{""Q0"":4}","trial","41944","survey-likert","17","352249","0.0-5.0-0.5","66","1","2022-11-29 22:30:12","2df368f4e41f066fd1c82c297b4a1108","189.145.205.164","Mozilla/5.0 (Windows NT 10.0; Win64; x64) AppleWebKit/537.36 (KHTML, like Gecko) Chrome/107.0.0.0 Safari/537.36","WebKit","Chrome","107.0.0.0","Windows","10.0","[0]","","16","4",""
"8684","You drop a bowling ball on a wine glass <br> T&uacute tiras una bola de boliche a una copa de vino","{""Q0"":4}","trial","41944","survey-likert","18","360937","0.0-5.0-0.6","66","1","2022-11-29 22:30:12","2df368f4e41f066fd1c82c297b4a1108","189.145.205.164","Mozilla/5.0 (Windows NT 10.0; Win64; x64) AppleWebKit/537.36 (KHTML, like Gecko) Chrome/107.0.0.0 Safari/537.36","WebKit","Chrome","107.0.0.0","Windows","10.0","[0]","","5","4",""
"6332","You see how an actress is taking a microphone <br> T&uacute ves como una actriz est&aacute agarrando el micr&oacutefono","{""Q0"":4}","trial","41944","survey-likert","19","367273","0.0-5.0-0.7","66","1","2022-11-29 22:30:12","2df368f4e41f066fd1c82c297b4a1108","189.145.205.164","Mozilla/5.0 (Windows NT 10.0; Win64; x64) AppleWebKit/537.36 (KHTML, like Gecko) Chrome/107.0.0.0 Safari/537.36","WebKit","Chrome","107.0.0.0","Windows","10.0","[0]","","51","4",""
"12412","You drop a cabbage on the table <br> T&uacute tiras una col a la mesa","{""Q0"":3}","trial","41944","survey-likert","20","379689","0.0-5.0-0.8","66","1","2022-11-29 22:30:12","2df368f4e41f066fd1c82c297b4a1108","189.145.205.164","Mozilla/5.0 (Windows NT 10.0; Win64; x64) AppleWebKit/537.36 (KHTML, like Gecko) Chrome/107.0.0.0 Safari/537.36","WebKit","Chrome","107.0.0.0","Windows","10.0","[0]","","35","3",""
"9684","You see how a butterfly is sitting on a flower <br> T&uacute ves como una mariposa est&aacute reposando en una flor","{""Q0"":3}","trial","41944","survey-likert","21","389377","0.0-5.0-0.9","66","1","2022-11-29 22:30:12","2df368f4e41f066fd1c82c297b4a1108","189.145.205.164","Mozilla/5.0 (Windows NT 10.0; Win64; x64) AppleWebKit/537.36 (KHTML, like Gecko) Chrome/107.0.0.0 Safari/537.36","WebKit","Chrome","107.0.0.0","Windows","10.0","[0]","","59","3",""
"11244","You drop a fork on the plate <br> T&uacute tiras un tenedor al plato","{""Q0"":3}","trial","41944","survey-likert","22","400625","0.0-5.0-0.10","66","1","2022-11-29 22:30:12","2df368f4e41f066fd1c82c297b4a1108","189.145.205.164","Mozilla/5.0 (Windows NT 10.0; Win64; x64) AppleWebKit/537.36 (KHTML, like Gecko) Chrome/107.0.0.0 Safari/537.36","WebKit","Chrome","107.0.0.0","Windows","10.0","[0]","","26","3",""
"8244","You drop a towel on the TV <br> T&uacute tiras una toalla a la televisi&oacuten","{""Q0"":4}","trial","41944","survey-likert","23","408873","0.0-5.0-0.11","66","1","2022-11-29 22:30:12","2df368f4e41f066fd1c82c297b4a1108","189.145.205.164","Mozilla/5.0 (Windows NT 10.0; Win64; x64) AppleWebKit/537.36 (KHTML, like Gecko) Chrome/107.0.0.0 Safari/537.36","WebKit","Chrome","107.0.0.0","Windows","10.0","[0]","","53","4",""
"9188","You see how a cook is taking a knife <br> T&uacute ves como un cocinero est&aacute agarrando un cuchillo","{""Q0"":4}","trial","41944","survey-likert","24","418065","0.0-5.0-0.12","66","1","2022-11-29 22:30:12","2df368f4e41f066fd1c82c297b4a1108","189.145.205.164","Mozilla/5.0 (Windows NT 10.0; Win64; x64) AppleWebKit/537.36 (KHTML, like Gecko) Chrome/107.0.0.0 Safari/537.36","WebKit","Chrome","107.0.0.0","Windows","10.0","[0]","","71","4",""
"9772","You drop a needle on the mouse pad <br> T&uacute tiras una aguja a la alfombrilla para el rat&oacuten","{""Q0"":4}","trial","41944","survey-likert","25","427841","0.0-5.0-0.13","66","1","2022-11-29 22:30:12","2df368f4e41f066fd1c82c297b4a1108","189.145.205.164","Mozilla/5.0 (Windows NT 10.0; Win64; x64) AppleWebKit/537.36 (KHTML, like Gecko) Chrome/107.0.0.0 Safari/537.36","WebKit","Chrome","107.0.0.0","Windows","10.0","[0]","","42","4",""
"7484","You see how a woman is paying with a debit card <br> T&uacute ves como una mujer est&aacute pagando con una tarjeta de d&eacutebito","{""Q0"":4}","trial","41944","survey-likert","26","435329","0.0-5.0-0.14","66","1","2022-11-29 22:30:12","2df368f4e41f066fd1c82c297b4a1108","189.145.205.164","Mozilla/5.0 (Windows NT 10.0; Win64; x64) AppleWebKit/537.36 (KHTML, like Gecko) Chrome/107.0.0.0 Safari/537.36","WebKit","Chrome","107.0.0.0","Windows","10.0","[0]","","64","4",""
"17652","You drop a bowling ball on a mirror <br> T&uacute tiras una bola de boliche a un espejo","{""Q0"":3}","trial","41944","survey-likert","27","452985","0.0-5.0-0.15","66","1","2022-11-29 22:30:12","2df368f4e41f066fd1c82c297b4a1108","189.145.205.164","Mozilla/5.0 (Windows NT 10.0; Win64; x64) AppleWebKit/537.36 (KHTML, like Gecko) Chrome/107.0.0.0 Safari/537.36","WebKit","Chrome","107.0.0.0","Windows","10.0","[0]","","15","3",""
"5916","You see how a dentist is drinking a can of cola <br> T&uacute ves como un dentista est&aacute bebiendo una lata de cola","{""Q0"":4}","trial","41944","survey-likert","28","458905","0.0-5.0-0.16","66","1","2022-11-29 22:30:12","2df368f4e41f066fd1c82c297b4a1108","189.145.205.164","Mozilla/5.0 (Windows NT 10.0; Win64; x64) AppleWebKit/537.36 (KHTML, like Gecko) Chrome/107.0.0.0 Safari/537.36","WebKit","Chrome","107.0.0.0","Windows","10.0","[0]","","47","4",""
"6884","You see how a student is writing on a board <br> T&uacute ves como un estudiante est&aacute escribiendo en la pizarra","{""Q0"":4}","trial","41944","survey-likert","29","465793","0.0-5.0-0.17","66","1","2022-11-29 22:30:12","2df368f4e41f066fd1c82c297b4a1108","189.145.205.164","Mozilla/5.0 (Windows NT 10.0; Win64; x64) AppleWebKit/537.36 (KHTML, like Gecko) Chrome/107.0.0.0 Safari/537.36","WebKit","Chrome","107.0.0.0","Windows","10.0","[0]","","50","4",""
"9252","You drop a bowling ball on a light bulb <br> T&uacute tiras una bola de boliche a una bombilla","{""Q0"":4}","trial","41944","survey-likert","30","475049","0.0-5.0-0.18","66","1","2022-11-29 22:30:12","2df368f4e41f066fd1c82c297b4a1108","189.145.205.164","Mozilla/5.0 (Windows NT 10.0; Win64; x64) AppleWebKit/537.36 (KHTML, like Gecko) Chrome/107.0.0.0 Safari/537.36","WebKit","Chrome","107.0.0.0","Windows","10.0","[0]","","14","4",""
"6964","You see how a postman is driving a car <br> T&uacute ves como un cartero est&aacute conduciendo un coche","{""Q0"":4}","trial","41944","survey-likert","31","482016","0.0-5.0-0.19","66","1","2022-11-29 22:30:12","2df368f4e41f066fd1c82c297b4a1108","189.145.205.164","Mozilla/5.0 (Windows NT 10.0; Win64; x64) AppleWebKit/537.36 (KHTML, like Gecko) Chrome/107.0.0.0 Safari/537.36","WebKit","Chrome","107.0.0.0","Windows","10.0","[0]","","32","4",""
"11972","You drop a bowling ball on a ceramic plate <br> T&uacute tiras una bola de boliche a un plato de cer&aacutemica","{""Q0"":3}","trial","41944","survey-likert","32","493992","0.0-5.0-0.20","66","1","2022-11-29 22:30:12","2df368f4e41f066fd1c82c297b4a1108","189.145.205.164","Mozilla/5.0 (Windows NT 10.0; Win64; x64) AppleWebKit/537.36 (KHTML, like Gecko) Chrome/107.0.0.0 Safari/537.36","WebKit","Chrome","107.0.0.0","Windows","10.0","[0]","","19","3",""
"12963","You drop a cushion on the magazine <br> T&uacute tiras un coj&iacuten a la revista","{""Q0"":3}","trial","41944","survey-likert","33","506960","0.0-5.0-0.21","66","1","2022-11-29 22:30:12","2df368f4e41f066fd1c82c297b4a1108","189.145.205.164","Mozilla/5.0 (Windows NT 10.0; Win64; x64) AppleWebKit/537.36 (KHTML, like Gecko) Chrome/107.0.0.0 Safari/537.36","WebKit","Chrome","107.0.0.0","Windows","10.0","[0]","","38","3",""
"14083","You drop a bowling ball on an empty can of beer <br> T&uacute tiras una bola de boliche a una lata de cerveza vac&iacutea","{""Q0"":4}","trial","41944","survey-likert","34","521048","0.0-5.0-0.22","66","1","2022-11-29 22:30:12","2df368f4e41f066fd1c82c297b4a1108","189.145.205.164","Mozilla/5.0 (Windows NT 10.0; Win64; x64) AppleWebKit/537.36 (KHTML, like Gecko) Chrome/107.0.0.0 Safari/537.36","WebKit","Chrome","107.0.0.0","Windows","10.0","[0]","","3","4",""
"7268","You drop a bowling ball on a tomato <br> T&uacute tiras una bola de boliche a un tomate","{""Q0"":3}","trial","41944","survey-likert","35","528320","0.0-5.0-0.23","66","1","2022-11-29 22:30:12","2df368f4e41f066fd1c82c297b4a1108","189.145.205.164","Mozilla/5.0 (Windows NT 10.0; Win64; x64) AppleWebKit/537.36 (KHTML, like Gecko) Chrome/107.0.0.0 Safari/537.36","WebKit","Chrome","107.0.0.0","Windows","10.0","[0]","","23","3",""
"8604","You see how a puppy is playing with a ball <br> T&uacute ves como un cachorro est&aacute jugando con una pelota","{""Q0"":4}","trial","41944","survey-likert","36","536929","0.0-5.0-0.24","66","1","2022-11-29 22:30:12","2df368f4e41f066fd1c82c297b4a1108","189.145.205.164","Mozilla/5.0 (Windows NT 10.0; Win64; x64) AppleWebKit/537.36 (KHTML, like Gecko) Chrome/107.0.0.0 Safari/537.36","WebKit","Chrome","107.0.0.0","Windows","10.0","[0]","","34","4",""
"11484","You drop a bowling ball on a piece of cake <br> T&uacute tiras una bola de boliche a un trozo de pastel","{""Q0"":3}","trial","41944","survey-likert","37","548417","0.0-5.0-0.25","66","1","2022-11-29 22:30:12","2df368f4e41f066fd1c82c297b4a1108","189.145.205.164","Mozilla/5.0 (Windows NT 10.0; Win64; x64) AppleWebKit/537.36 (KHTML, like Gecko) Chrome/107.0.0.0 Safari/537.36","WebKit","Chrome","107.0.0.0","Windows","10.0","[0]","","2","3",""
"10612","You drop a bowling ball on a donut <br> T&uacute tiras una bola de boliche a una rosquilla","{""Q0"":3}","trial","41944","survey-likert","38","559033","0.0-5.0-0.26","66","1","2022-11-29 22:30:12","2df368f4e41f066fd1c82c297b4a1108","189.145.205.164","Mozilla/5.0 (Windows NT 10.0; Win64; x64) AppleWebKit/537.36 (KHTML, like Gecko) Chrome/107.0.0.0 Safari/537.36","WebKit","Chrome","107.0.0.0","Windows","10.0","[0]","","17","3",""
"10468","You drop a remote on the rug <br> T&uacute tiras un control remoto a la alfombra","{""Q0"":3}","trial","41944","survey-likert","39","569505","0.0-5.0-0.27","66","1","2022-11-29 22:30:12","2df368f4e41f066fd1c82c297b4a1108","189.145.205.164","Mozilla/5.0 (Windows NT 10.0; Win64; x64) AppleWebKit/537.36 (KHTML, like Gecko) Chrome/107.0.0.0 Safari/537.36","WebKit","Chrome","107.0.0.0","Windows","10.0","[0]","","39","3",""
"5668","You see how an owl is sitting on the branch <br> T&uacute ves como un b&uacuteho est&aacute reposando en una rama","{""Q0"":4}","trial","41944","survey-likert","40","575177","0.0-5.0-0.28","66","1","2022-11-29 22:30:12","2df368f4e41f066fd1c82c297b4a1108","189.145.205.164","Mozilla/5.0 (Windows NT 10.0; Win64; x64) AppleWebKit/537.36 (KHTML, like Gecko) Chrome/107.0.0.0 Safari/537.36","WebKit","Chrome","107.0.0.0","Windows","10.0","[0]","","69","4",""
"5484","You see how a donkey is drinking water <br> T&uacute ves como un burro est&aacute bebiendo agua","{""Q0"":4}","trial","41944","survey-likert","41","580665","0.0-5.0-0.29","66","1","2022-11-29 22:30:12","2df368f4e41f066fd1c82c297b4a1108","189.145.205.164","Mozilla/5.0 (Windows NT 10.0; Win64; x64) AppleWebKit/537.36 (KHTML, like Gecko) Chrome/107.0.0.0 Safari/537.36","WebKit","Chrome","107.0.0.0","Windows","10.0","[0]","","45","4",""
"6908","You see how a pilot is reading a book <br> T&uacute ves como un piloto est&aacute leyendo un libro","{""Q0"":4}","trial","41944","survey-likert","42","587577","0.0-5.0-0.30","66","1","2022-11-29 22:30:12","2df368f4e41f066fd1c82c297b4a1108","189.145.205.164","Mozilla/5.0 (Windows NT 10.0; Win64; x64) AppleWebKit/537.36 (KHTML, like Gecko) Chrome/107.0.0.0 Safari/537.36","WebKit","Chrome","107.0.0.0","Windows","10.0","[0]","","61","4",""
"11708","You drop a bowling ball on a strawberry <br> T&uacute tiras una bola de boliche a una fresa","{""Q0"":3}","trial","41944","survey-likert","43","599289","0.0-5.0-0.31","66","1","2022-11-29 22:30:12","2df368f4e41f066fd1c82c297b4a1108","189.145.205.164","Mozilla/5.0 (Windows NT 10.0; Win64; x64) AppleWebKit/537.36 (KHTML, like Gecko) Chrome/107.0.0.0 Safari/537.36","WebKit","Chrome","107.0.0.0","Windows","10.0","[0]","","20","3",""
"8620","You see how a hairdresser is taking scissors <br> T&uacute ves como una peluquera est&aacute agarrando las tijeras","{""Q0"":4}","trial","41944","survey-likert","44","607913","0.0-5.0-0.32","66","1","2022-11-29 22:30:12","2df368f4e41f066fd1c82c297b4a1108","189.145.205.164","Mozilla/5.0 (Windows NT 10.0; Win64; x64) AppleWebKit/537.36 (KHTML, like Gecko) Chrome/107.0.0.0 Safari/537.36","WebKit","Chrome","107.0.0.0","Windows","10.0","[0]","","60","4",""
"8683","You drop a bowling ball on a cracker <br> T&uacute tiras una bola de boliche a una galleta","{""Q0"":3}","trial","41944","survey-likert","45","616600","0.0-5.0-0.33","66","1","2022-11-29 22:30:12","2df368f4e41f066fd1c82c297b4a1108","189.145.205.164","Mozilla/5.0 (Windows NT 10.0; Win64; x64) AppleWebKit/537.36 (KHTML, like Gecko) Chrome/107.0.0.0 Safari/537.36","WebKit","Chrome","107.0.0.0","Windows","10.0","[0]","","4","3",""
"10404","You drop a bowling ball on a chocolate ice-cream <br> T&uacute tiras una bola de boliche a un helado de chocolate","{""Q0"":3}","trial","41944","survey-likert","46","627008","0.0-5.0-0.34","66","1","2022-11-29 22:30:12","2df368f4e41f066fd1c82c297b4a1108","189.145.205.164","Mozilla/5.0 (Windows NT 10.0; Win64; x64) AppleWebKit/537.36 (KHTML, like Gecko) Chrome/107.0.0.0 Safari/537.36","WebKit","Chrome","107.0.0.0","Windows","10.0","[0]","","11","3",""
"5675","You see how a doctor is taking a stethoscope <br> T&uacute ves como un doctor est&aacute agarrando un estetoscopio","{""Q0"":4}","trial","41944","survey-likert","47","632688","0.0-5.0-0.35","66","1","2022-11-29 22:30:12","2df368f4e41f066fd1c82c297b4a1108","189.145.205.164","Mozilla/5.0 (Windows NT 10.0; Win64; x64) AppleWebKit/537.36 (KHTML, like Gecko) Chrome/107.0.0.0 Safari/537.36","WebKit","Chrome","107.0.0.0","Windows","10.0","[0]","","49","4",""
"5620","You drop a keyboard on the bed <br> T&uacute tiras un teclado a la cama","{""Q0"":3}","trial","41944","survey-likert","48","638313","0.0-5.0-0.36","66","1","2022-11-29 22:30:12","2df368f4e41f066fd1c82c297b4a1108","189.145.205.164","Mozilla/5.0 (Windows NT 10.0; Win64; x64) AppleWebKit/537.36 (KHTML, like Gecko) Chrome/107.0.0.0 Safari/537.36","WebKit","Chrome","107.0.0.0","Windows","10.0","[0]","","36","3",""
"16051","You see how an old man is hammering a nail <br> T&uacute ves como un hombre anciano est&aacute martillando un clavo","{""Q0"":4}","trial","41944","survey-likert","49","654368","0.0-5.0-0.37","66","1","2022-11-29 22:30:12","2df368f4e41f066fd1c82c297b4a1108","189.145.205.164","Mozilla/5.0 (Windows NT 10.0; Win64; x64) AppleWebKit/537.36 (KHTML, like Gecko) Chrome/107.0.0.0 Safari/537.36","WebKit","Chrome","107.0.0.0","Windows","10.0","[0]","","29","4",""
"5867","You drop a watch on the laptop <br> T&uacute tiras un reloj al port&aacutetil","{""Q0"":3}","trial","41944","survey-likert","50","660241","0.0-5.0-0.38","66","1","2022-11-29 22:30:12","2df368f4e41f066fd1c82c297b4a1108","189.145.205.164","Mozilla/5.0 (Windows NT 10.0; Win64; x64) AppleWebKit/537.36 (KHTML, like Gecko) Chrome/107.0.0.0 Safari/537.36","WebKit","Chrome","107.0.0.0","Windows","10.0","[0]","","37","3",""
"4731","You drop a bowling ball on an iPAD <br> T&uacute tiras una bola de boliche a un iPad","{""Q0"":3}","trial","41944","survey-likert","51","664976","0.0-5.0-0.39","66","1","2022-11-29 22:30:12","2df368f4e41f066fd1c82c297b4a1108","189.145.205.164","Mozilla/5.0 (Windows NT 10.0; Win64; x64) AppleWebKit/537.36 (KHTML, like Gecko) Chrome/107.0.0.0 Safari/537.36","WebKit","Chrome","107.0.0.0","Windows","10.0","[0]","","12","3",""
"5667","You drop a bowling ball on an egg <br> T&uacute tiras una bola de boliche a un huevo","{""Q0"":3}","trial","41944","survey-likert","52","670649","0.0-5.0-0.40","66","1","2022-11-29 22:30:12","2df368f4e41f066fd1c82c297b4a1108","189.145.205.164","Mozilla/5.0 (Windows NT 10.0; Win64; x64) AppleWebKit/537.36 (KHTML, like Gecko) Chrome/107.0.0.0 Safari/537.36","WebKit","Chrome","107.0.0.0","Windows","10.0","[0]","","6","3",""
